1,EL RAUL Y EL CORREA SON WEKITOS?,NO,SI,NO,NO,2
2,¿Qué es la herencia en Java?,Un mecanismo que permite que una clase adquiera atributos y métodos de otra,Una forma de copiar automáticamente todo el código de una clase a otra,Un proceso exclusivo para heredar solo variables estáticas,Una técnica que se usa únicamente con interfaces,1
3,¿Qué palabra reservada se utiliza en Java para heredar de otra clase?,`inherits`,`extends`,`superclass`,`derive`,2
4,¿Qué significa sobrescribir (override) un método en Java?,Redefinir un método heredado en la subclase con la misma firma pero con un comportamiento distinto,Copiar un método de la superclase a la subclase sin cambios,Crear un método con el mismo nombre pero diferente número de parámetros,Borrar un método de la superclase desde la subclase,1
5,En un programa de Java se tiene una superclase llamada Persona y dos subclases llamadas Alumno y Profesor. Tanto Alumno como Profesor heredan de Persona. Selecciona la única declaración/instanciación que refleja correctamente el uso de herencia y polimorfismo:,Persona p = new Persona();,Profesor p = new Persona();,Profesor p = new Alumno();,Persona p = new Alumno();,4
6,En el siguiente código falta una implementación. ¿Cuál es la opción correcta?,Implementar el método hacerSonido() en la clase Perro,Hacer abstracto el método hacerSonido() en Animal,Quitar el constructor de Animal,Declarar Perro como abstracto,1
